{
  "schema_version": "kspacejet.run-record/v1",
  "kind": "RunRecord",
  "run_id": "scan.pre-admission.cancelled",
  "execution_profile": "bounded-online",
  "outcome": "cancelled_before_admission",
  "recovery_class": "fail_stop_no_resume",
  "egress_visibility": "none",
  "primary_cause": {
    "kind": "cancellation",
    "code": "USER_CANCELLED"
  },
  "secondary_causes": []
}
